{
  "id": "web/live-topviewer-apikey",
  "description": "Live recording: TopViewer Memorix media API shape with synthetic demo key (apiKey=fixture-key)",
  "source_evidence": {
    "path": "crates/xtask/src/live.rs topviewer_media_api (synthetic apiKey)",
    "snapshot": "live-triage-2026-09-07"
  },
  "input": {
    "mode": "automatic",
    "url": "https://fixtures.test/live/topviewer/mediabank.html"
  },
  "operation": "discover"
}
