{
  "id": "formats/fzp",
  "description": "Synthetic JPEG pyramids exercise FreezoomPack 1.1 floor and 1.3 ceil rounding, including fractional strips and edge tiles in native and browser output.",
  "source_evidence": {
    "snapshot": "FreezoomPack implementation specification, observed 2026-09-29; synthetic data",
    "path": "crates/dezoomify/src/fzp/mod.rs"
  },
  "input": { "url": "http://{{origin}}/fzp/resources/floor/root.xml" },
  "operation": "assemble"
}
