{
  "description": "Tile assembly pixel layouts",
  "id": "web/assembly",
  "input": {
    "mode": "explicit",
    "url": "http://127.0.0.1/fixtures/assembly/tile.svg"
  },
  "operation": "assemble",
  "source_evidence": {
    "path": "tests/dezoomers.spec.js renderAssembly",
    "snapshot": "f7caa07"
  }
}
