{
  "description": "Adaptive generic probing shapes",
  "id": "web/generic-probing",
  "input": {
    "mode": "automatic",
    "url": "http://127.0.0.1/fixtures/generic/tile.svg?x={{X}}&y={{Y}}"
  },
  "operation": "probe",
  "source_evidence": {
    "path": "tests/dezoomers.spec.js probeGeneric",
    "snapshot": "f7caa07"
  }
}
